{
  "scope_id": "scp_2026-10-12_release",
  "tool": "gitlab-cli",
  "granted_by": "Sean",
  "granted_at": "2026-10-12T10:00:00Z",
  "expires_at": null,
  "effects": ["change", "deliver", "artifact"],
  "dangerous": true,
  "targets": [{"key": "acme/web!"}, {"key": "acme/web:hook/3", "match": "exact"}, {"key": "acme/web:job/"}],
  "destinations": ["https://hooks.acme.test/"],
  "outputs": ["C:\\work\\triage"],
  "limits": {"max_operations": 20},
  "notes": "Release day: merge, notify the release hook, fetch artifacts."
}
